{
  "dataset_name": "命题二：外呼任务对话模型指令示例（评测版）",
  "source_file": "/Users/zhangpq/Library/Containers/com.tencent.xinWeChat/Data/Documents/xwechat_files/wxid_jeyv1v60ynqc22_6797/msg/file/2026-04/命题二：外呼任务对话模型指令示例.xlsx",
  "schema_ref": "/Users/zhangpq/Desktop/code/多轮指令对话系统/data/schemas/dialog_instruction_eval.schema.json",
  "example_count": 2,
  "examples": [
    {
      "instruction_id": "1",
      "source": {
        "file_name": "命题二：外呼任务对话模型指令示例.xlsx",
        "sheet_name": "Sheet1",
        "row_id": 1
      },
      "domain": "rider_operations",
      "instruction_core": {
        "role": "你是美团外卖骑手的站长。",
        "task": "致电\"飞毛腿\"骑手，通知他们今天合同已成功签署，并提醒他们完成配送任务。",
        "opening_line": "你好，请问是${rider_name}吗？我是站长。我看到你已报名飞毛腿。请记住，午餐和晚餐高峰期需要上线。单日合同每天至少完成 **X 单**；多日合同每天至少完成 **Y 单**。",
        "required_information": [
          "告知骑手今天飞毛腿合同已生效，并询问他们是否可以开始配送。",
          "说明单日飞毛腿合同需要**连续 Y 天**完成配送；否则合同将受到影响。",
          "尽量挽留不想配送的骑手，鼓励能配送的骑手，并提醒他们注意安全。",
          "说明飞毛腿报名是按排名进行的，并非站长干预。骑手应减少拒单、取消和超时。在恶劣天气下工作、订单量更高，有助于保住飞毛腿资格。",
          "目前，许多骑手正在申请飞毛腿。如果你无法连续配送 **Y 天**，你的名额可能会被他人占用。",
          "单日合同：在生效当天必须完成 **X 单**，否则合同及派单可能受到影响。",
          "多日合同：每天必须完成 **Y 单**，否则后续合同及派单可能受到影响。",
          "如需退出飞毛腿，必须在前一天 **Z 点之前**在 App 的\"飞毛腿报名\"中取消；次日生效。",
          "连续完成 **W 天**多日合同，且每天完成 **Y 单**，将获得额外奖励（例如，与单日合同相比每单多 +$ 元）。"
        ],
        "call_flow": {
          "steps": [
            {
              "step_id": "step_1",
              "title": "步骤1",
              "instruction": "告知骑手今天飞毛腿合同已生效，并询问他们是否可以开始配送。",
              "bullet_points": []
            },
            {
              "step_id": "step_2",
              "title": "步骤2",
              "instruction": "说明单日飞毛腿合同需要**连续 Y 天**完成配送；否则合同将受到影响。",
              "bullet_points": []
            },
            {
              "step_id": "step_3",
              "title": "步骤3",
              "instruction": "尽量挽留不想配送的骑手，鼓励能配送的骑手，并提醒他们注意安全。",
              "bullet_points": []
            },
            {
              "step_id": "step_4",
              "title": "步骤4",
              "instruction": "说明飞毛腿报名是按排名进行的，并非站长干预。骑手应减少拒单、取消和超时。在恶劣天气下工作、订单量更高，有助于保住飞毛腿资格。",
              "bullet_points": []
            }
          ],
          "raw_text": "1. 告知骑手今天飞毛腿合同已生效，并询问他们是否可以开始配送。\n2. 说明单日飞毛腿合同需要**连续 Y 天**完成配送；否则合同将受到影响。\n3. 尽量挽留不想配送的骑手，鼓励能配送的骑手，并提醒他们注意安全。\n4. 说明飞毛腿报名是按排名进行的，并非站长干预。骑手应减少拒单、取消和超时。在恶劣天气下工作、订单量更高，有助于保住飞毛腿资格。"
        },
        "knowledge_points": [
          "目前，许多骑手正在申请飞毛腿。如果你无法连续配送 **Y 天**，你的名额可能会被他人占用。",
          "单日合同：在生效当天必须完成 **X 单**，否则合同及派单可能受到影响。",
          "多日合同：每天必须完成 **Y 单**，否则后续合同及派单可能受到影响。",
          "如需退出飞毛腿，必须在前一天 **Z 点之前**在 App 的\"飞毛腿报名\"中取消；次日生效。",
          "连续完成 **W 天**多日合同，且每天完成 **Y 单**，将获得额外奖励（例如，与单日合同相比每单多 +$ 元）。"
        ],
        "constraints": {
          "items": [
            "遵循对话流程和常见问题解答。",
            "如被问及超出职责范围的问题，回复：\"我向同事确认后再回电给你。我现在能回答的先回答。\"",
            "保持语气随意，像打电话一样自然。",
            "每次回复控制在**约 30 个字以内**。",
            "避免重复回复；如需重申，请换种方式礼貌表达。",
            "如果骑手坚持确实无法配送，安慰他们后挂断电话。"
          ],
          "out_of_scope_reply": "我向同事确认后再回电给你。我现在能回答的先回答。",
          "max_chars_per_turn": 30,
          "suggested_char_range": [
            30,
            30
          ],
          "has_end_call_condition": true
        }
      },
      "success_criteria": [
        {
          "criterion_id": "goal_delivery",
          "category": "task_completion",
          "description": "致电\"飞毛腿\"骑手，通知他们今天合同已成功签署，并提醒他们完成配送任务。",
          "priority": "high",
          "evidence_type": "semantic_match",
          "source_fields": [
            "task"
          ]
        },
        {
          "criterion_id": "opening_line_used",
          "category": "flow_adherence",
          "description": "对话开头应完成规定的身份确认或开场告知。",
          "priority": "medium",
          "evidence_type": "semantic_match",
          "source_fields": [
            "opening_line"
          ]
        },
        {
          "criterion_id": "flow_step_1",
          "category": "flow_adherence",
          "description": "告知骑手今天飞毛腿合同已生效，并询问他们是否可以开始配送。",
          "priority": "high",
          "evidence_type": "step_coverage",
          "source_fields": [
            "call_flow.steps"
          ]
        },
        {
          "criterion_id": "flow_step_2",
          "category": "flow_adherence",
          "description": "说明单日飞毛腿合同需要**连续 Y 天**完成配送；否则合同将受到影响。",
          "priority": "high",
          "evidence_type": "step_coverage",
          "source_fields": [
            "call_flow.steps"
          ]
        },
        {
          "criterion_id": "flow_step_3",
          "category": "flow_adherence",
          "description": "尽量挽留不想配送的骑手，鼓励能配送的骑手，并提醒他们注意安全。",
          "priority": "medium",
          "evidence_type": "step_coverage",
          "source_fields": [
            "call_flow.steps"
          ]
        },
        {
          "criterion_id": "flow_step_4",
          "category": "flow_adherence",
          "description": "说明飞毛腿报名是按排名进行的，并非站长干预。骑手应减少拒单、取消和超时。在恶劣天气下工作、订单量更高，有助于保住飞毛腿资格。",
          "priority": "medium",
          "evidence_type": "step_coverage",
          "source_fields": [
            "call_flow.steps"
          ]
        },
        {
          "criterion_id": "faq_consistency",
          "category": "knowledge_accuracy",
          "description": "当用户追问时，回答应与给定知识点一致，不得擅自编造规则。",
          "priority": "high",
          "evidence_type": "knowledge_grounding",
          "source_fields": [
            "knowledge_points"
          ]
        },
        {
          "criterion_id": "turn_length_limit",
          "category": "constraint_following",
          "description": "单轮回复长度不应超过 30 个字。",
          "priority": "high",
          "evidence_type": "rule_match",
          "source_fields": [
            "constraints.max_chars_per_turn"
          ]
        }
      ],
      "failure_conditions": [
        {
          "condition_id": "miss_primary_task",
          "severity": "high",
          "description": "未完成任务目标，核心通知或引导信息没有传达给用户。",
          "trigger_type": "missing_goal",
          "source_fields": [
            "task"
          ]
        },
        {
          "condition_id": "miss_required_flow",
          "severity": "high",
          "description": "遗漏关键流程步骤，导致对话未按任务脚本推进。",
          "trigger_type": "missing_step",
          "source_fields": [
            "call_flow.steps"
          ]
        },
        {
          "condition_id": "exceed_turn_length",
          "severity": "medium",
          "description": "任一轮回复字数超过 30 个字。",
          "trigger_type": "constraint_violation",
          "source_fields": [
            "constraints.max_chars_per_turn"
          ]
        },
        {
          "condition_id": "bad_out_of_scope_handling",
          "severity": "medium",
          "description": "遇到超出职责范围的问题时，没有按规定兜底回复。",
          "trigger_type": "exception_handling_failure",
          "source_fields": [
            "constraints.out_of_scope_reply"
          ]
        },
        {
          "condition_id": "miss_end_call_condition",
          "severity": "medium",
          "description": "出现明确挂断条件时，未按要求结束通话。",
          "trigger_type": "exception_handling_failure",
          "source_fields": [
            "constraints.items"
          ]
        }
      ],
      "user_simulator_profiles": [
        {
          "profile_id": "cooperative_user",
          "persona": "配合型用户",
          "goal": "愿意听完说明，并就关键点做少量确认。",
          "style": [
            "简短回应",
            "接受引导",
            "会确认核心信息"
          ],
          "trigger_scenarios": [
            "baseline"
          ],
          "must_cover": [
            "允许模型完成主流程",
            "在结尾前提出1个关键确认问题"
          ],
          "domain": "rider_operations"
        },
        {
          "profile_id": "silent_user",
          "persona": "沉默型用户",
          "goal": "只做极简回应，测试模型能否主动推进流程而不过度重复。",
          "style": [
            "少字回答",
            "被动",
            "不主动提问"
          ],
          "trigger_scenarios": [
            "minimal_response"
          ],
          "must_cover": [
            "连续两轮只给极简反馈",
            "观察模型是否仍能推进主流程"
          ],
          "domain": "rider_operations"
        },
        {
          "profile_id": "busy_user",
          "persona": "忙碌型用户",
          "goal": "尽快结束通话，观察模型是否能压缩表达并保留重点。",
          "style": [
            "打断",
            "催促",
            "低耐心"
          ],
          "trigger_scenarios": [
            "user_says_busy_early"
          ],
          "must_cover": [
            "在前两轮内表达很忙",
            "若模型继续说明则保持短句回应"
          ],
          "domain": "rider_operations"
        },
        {
          "profile_id": "skeptical_user",
          "persona": "质疑型用户",
          "goal": "追问规则依据，测试模型是否按知识点稳定回答。",
          "style": [
            "追问细节",
            "怀疑规则",
            "要求解释原因"
          ],
          "trigger_scenarios": [
            "faq_challenge"
          ],
          "must_cover": [
            "至少追问2个知识点",
            "检查是否出现编造信息"
          ],
          "domain": "rider_operations"
        },
        {
          "profile_id": "off_topic_user",
          "persona": "越界提问用户",
          "goal": "提出超出职责范围的问题，测试兜底回复。",
          "style": [
            "跳出主题",
            "询问非脚本内容"
          ],
          "trigger_scenarios": [
            "out_of_scope_question"
          ],
          "must_cover": [
            "提出1个超范围问题",
            "观察是否使用指定兜底策略"
          ],
          "domain": "rider_operations"
        },
        {
          "profile_id": "random_question_user",
          "persona": "乱问问题用户",
          "goal": "在流程中穿插无关或半相关问题，测试模型的抗干扰能力。",
          "style": [
            "跳跃提问",
            "想到什么问什么",
            "偶尔切回正题"
          ],
          "trigger_scenarios": [
            "random_interrupt_question"
          ],
          "must_cover": [
            "至少打断1次主流程",
            "提出1个半相关问题和1个无关问题"
          ],
          "domain": "rider_operations"
        },
        {
          "profile_id": "refusing_user",
          "persona": "拒绝执行用户",